TRIP_ID,RT_ID,RT_NAME,RT_VER,STP_NM,RT_STP_NUM,RT_NUM_STPS,RT_ID_VER,RT_DIR,RT_GRP,RT_GRP_NUM,ROUTE_ID,V_ID,STP_ARV_TM,STP_ARV_DTTM,STP_ID,DATA_TYPE,DATA_FLG,TEMP_IDX,STP_LAT,STP_LON
23867691-240304-MULTI-Weekday-03,23,Sandalwood,2,The Gore Rd s/of Fogal Rd,3,97,23_2,West,sandalwood,495,,,,,,,0,1,43.769367,-79.659158
23867691-240304-MULTI-Weekday-03,23,Sandalwood,2,The Gore Rd s/of Ebenezer Rd,4,97,23_2,West,sandalwood,495,,,,,,,0,2,43.771825,-79.662653
23867691-240304-MULTI-Weekday-03,23,Sandalwood,2,Ebenezer Rd w/of Nexus Ave,6,97,23_2,West,sandalwood,495,,,,,,,0,4,43.774063,-79.660847
23867691-240304-MULTI-Weekday-03,23,Sandalwood,2,Via Romano Way at Zia Dodda Cres,8,97,23_2,West,sandalwood,495,,,,,,,0,6,43.780399,-79.66021
23867691-240304-MULTI-Weekday-03,23,Sandalwood,2,Cottrelle Blvd w/of Clarkway Dr,10,97,23_2,West,sandalwood,495,,,,,,,0,8,43.783889,-79.664269
23867691-240304-MULTI-Weekday-03,23,Sandalwood,2,Cottrelle Blvd at The Gore Rd,13,97,23_2,West,sandalwood,495,,,,,,,0,11,43.77969,-79.674247
23867691-240304-MULTI-Weekday-03,23,Sandalwood,2,Cottrelle Blvd at Maple Valley St (w/of McVean Dr),18,97,23_2,West,sandalwood,495,,,,,,,0,16,43.771797,-79.690439
23867691-240304-MULTI-Weekday-03,23,Sandalwood,2,Cottrelle Blvd at Calderstone Rd,19,97,23_2,West,sandalwood,495,,,,,,,0,17,43.771128,-79.693013
23867691-240304-MULTI-Weekday-03,23,Sandalwood,2,Cottrelle Blvd w/of Valleycreek Dr,22,97,23_2,West,sandalwood,495,,,,,,,0,20,43.772155,-79.704167
23867691-240304-MULTI-Weekday-03,23,Sandalwood,2,Goreway Dr n/of Cottrelle Blvd,24,97,23_2,West,sandalwood,495,,,,,,,0,22,43.770524,-79.707765
23867691-240304-MULTI-Weekday-03,23,Sandalwood,2,Castlemore Rd e/of Crystall Hill Dr,26,97,23_2,West,sandalwood,495,,,,,,,0,24,43.769918,-79.714829
23867691-240304-MULTI-Weekday-03,23,Sandalwood,2,Humberwest Pkwy n/of Crystal Hill Dr,28,97,23_2,West,sandalwood,495,,,,,,,0,26,43.769308,-79.721813
23867691-240304-MULTI-Weekday-03,23,Sandalwood,2,Humberwest Pkwy e/of Airport Rd,30,97,23_2,West,sandalwood,495,,,,,,,0,28,43.769265,-79.729366
23867691-240304-MULTI-Weekday-03,23,Sandalwood,2,Humberwest Pkwy e/of Airport Rd,30,97,23_2,West,sandalwood,495,,,,,,,0,28,43.769483,-79.72962
23867691-240304-MULTI-Weekday-03,23,Sandalwood,2,Sandalwood Pky E at Revelstoke (w/of Airport Rd),31,97,23_2,West,sandalwood,495,,,,,,,0,29,43.768236,-79.73205
23867691-240304-MULTI-Weekday-03,23,Sandalwood,2,Sandalwood Pky E at Hidden Peak Dr,32,97,23_2,West,sandalwood,495,,,,,,,0,30,43.767956,-79.734008
23867691-240304-MULTI-Weekday-03,23,Sandalwood,2,Sandalwood Pky E at Pine Landing Trail,34,97,23_2,West,sandalwood,495,,,,,,,0,32,43.766633,-79.740268
23867691-240304-MULTI-Weekday-03,23,Sandalwood,2,Sandalwood Pky E at Cedarcliff Trail,35,97,23_2,West,sandalwood,495,,,,,,,0,33,43.766232,-79.746227
23867691-240304-MULTI-Weekday-03,23,Sandalwood,2,Sandalwood Pky E at Cedarcliff Trail,35,97,23_2,West,sandalwood,495,,,,,,,0,33,43.766615,-79.74565
23867691-240304-MULTI-Weekday-03,23,Sandalwood,2,Sandalwood Pky E at Torbram Rd,36,97,23_2,West,sandalwood,495,,,,,,,0,34,43.764935,-79.748693
23867691-240304-MULTI-Weekday-03,23,Sandalwood,2,Sandalwood Pky E at Torbram Rd,36,97,23_2,West,sandalwood,495,,,,,,,0,34,43.765532,-79.74841
23867691-240304-MULTI-Weekday-03,23,Sandalwood,2,Sandalwood Pky E w/of Torbram Rd,37,97,23_2,West,sandalwood,495,,,,,,,0,35,43.764781,-79.749442
23867691-240304-MULTI-Weekday-03,23,Sandalwood,2,Sandalwood Pky E at Sugarcane Ave,38,97,23_2,West,sandalwood,495,,,,,,,0,36,43.763379,-79.751163
23867691-240304-MULTI-Weekday-03,23,Sandalwood,2,Sandalwood Pky E at Chapparal Dr,39,97,23_2,West,sandalwood,495,,,,,,,0,37,43.761766,-79.75242
23867691-240304-MULTI-Weekday-03,23,Sandalwood,2,Sandalwood Pky E at Blackcherry Lane,40,97,23_2,West,sandalwood,495,,,,,,,0,38,43.759794,-79.753234
23867691-240304-MULTI-Weekday-03,23,Sandalwood,2,Sandalwood Pky E at Sunny Meadow Blvd,41,97,23_2,West,sandalwood,495,,,,,,,0,39,43.757672,-79.754481
23867691-240304-MULTI-Weekday-03,23,Sandalwood,2,Sandalwood Pkwy btwn Bramalea Rd and Sunny Meadow,42,97,23_2,West,sandalwood,495,,,,,,,0,40,43.755392,-79.755727
23867691-240304-MULTI-Weekday-03,23,Sandalwood,2,Sandalwood Pkwy btwn Bramalea Rd and Sunny Meadow,42,97,23_2,West,sandalwood,495,,,,,,,0,40,43.755163,-79.756464
23867691-240304-MULTI-Weekday-03,23,Sandalwood,2,Sandalwood Pkwy w/of Bramalea Rd,43,97,23_2,West,sandalwood,495,,,,,,,0,41,43.753657,-79.758099
23867691-240304-MULTI-Weekday-03,23,Sandalwood,2,Sandalwood Pky E at Rattlesnake Rd,44,97,23_2,West,sandalwood,495,,,,,,,0,42,43.752768,-79.759587
23867691-240304-MULTI-Weekday-03,23,Sandalwood,2,Sandalwood Pky E btwn Rattlesnake and Fernforest,45,97,23_2,West,sandalwood,495,,,,,,,0,43,43.751322,-79.761982
23867691-240304-MULTI-Weekday-03,23,Sandalwood,2,Sandalwood Pky E at Fernforest Dr,46,97,23_2,West,sandalwood,495,,,,,,,0,44,43.749717,-79.763846
23867691-240304-MULTI-Weekday-03,23,Sandalwood,2,Sandalwood Pky E at Fernforest Dr,46,97,23_2,West,sandalwood,495,,,,,,,0,44,43.750267,-79.763544
23867691-240304-MULTI-Weekday-03,23,Sandalwood,2,Sandalwood Pky E opp Springtown Trail,48,97,23_2,West,sandalwood,495,,,,,,,0,46,43.746646,-79.767543
23867691-240304-MULTI-Weekday-03,23,Sandalwood,2,Sandalwood Pky E w/of Dixie Rd,49,97,23_2,West,sandalwood,495,,,,,,,0,47,43.744874,-79.769621
23867691-240304-MULTI-Weekday-03,23,Sandalwood,2,Great Lakes Dr s/of Serenity Ln,53,97,23_2,West,sandalwood,495,,,,,,,0,51,43.734727,-79.767261
23867691-240304-MULTI-Weekday-03,23,Sandalwood,2,Trinity Common Terminal Route 32/23 WB/18B Stop,55,97,23_2,West,sandalwood,495,,,,,,,0,53,43.73109,-79.763603
23867691-240304-MULTI-Weekday-03,23,Sandalwood,2,Heart Lake Rd at 10111 Heart Lake Rd (Lowe's),57,97,23_2,West,sandalwood,495,,,,,,,0,55,43.724183,-79.771506
23867704-240304-MULTI-Weekday-03,18,Dixie,2,Dixie Rd s/of Clark Blvd,42,80,18_2,South,dixie,473,,,,,,,0,59,43.710095,-79.722081
23867704-240304-MULTI-Weekday-03,18,Dixie,2,Dixie Rd s/of Clark Blvd,42,80,18_2,South,dixie,473,,,,,,,0,59,43.710581,-79.722202
23867704-240304-MULTI-Weekday-03,18,Dixie,2,Dixie Rd at Balmoral Dr (Rogers),44,80,18_2,South,dixie,473,,,,,,,0,61,43.705935,-79.716447
23867704-240304-MULTI-Weekday-03,18,Dixie,2,Dixie Rd s/of Orenda Rd (N),46,80,18_2,South,dixie,473,,,,,,,0,63,43.701071,-79.710125
23867704-240304-MULTI-Weekday-03,18,Dixie,2,Dixie Rd at Orenda Rd (S),47,80,18_2,South,dixie,473,,,,,,,0,64,43.699928,-79.70831
23867704-240304-MULTI-Weekday-03,18,Dixie,2,Dixie Rd btwn Orenda Rd & Steeles Ave E,48,80,18_2,South,dixie,473,,,,,,,0,65,43.697792,-79.705713
23867704-240304-MULTI-Weekday-03,18,Dixie,2,Dixie Rd s/of Steeles Ave E,50,80,18_2,South,dixie,473,,,,,,,0,67,43.69409,-79.700109
23867704-240304-MULTI-Weekday-03,18,Dixie,2,Dixie Rd at Derry Rd,54,80,18_2,South,dixie,473,,,,,,,0,71,43.675763,-79.675589
23867704-240304-MULTI-Weekday-03,18,Dixie,2,Dixie Rd at Mid-way Blvd,56,80,18_2,South,dixie,473,,,,,,,0,73,43.668453,-79.665473
23867704-240304-MULTI-Weekday-03,18,Dixie,2,Meyerside Dr at Ordan Dr,59,80,18_2,South,dixie,473,,,,,,,0,76,43.658869,-79.6559
23867704-240304-MULTI-Weekday-03,18,Dixie,2,Meyerside Dr at Vipond Dr,60,80,18_2,South,dixie,473,,,,,,,0,77,43.656599,-79.658466
23867704-240304-MULTI-Weekday-03,18,Dixie,2,Courtneypark Dr btwn Tomken Rd and Shawson Dr,65,80,18_2,South,dixie,473,,,,,,,0,82,43.656385,-79.666757
23867704-240304-MULTI-Weekday-03,18,Dixie,2,Courtneypark Dr e/of Shawson Dr,66,80,18_2,South,dixie,473,,,,,,,0,83,43.657659,-79.664844
23867704-240304-MULTI-Weekday-03,18,Dixie,2,Courtneypark Dr at Vipond Dr,67,80,18_2,South,dixie,473,,,,,,,0,84,43.659087,-79.662952
23867704-240304-MULTI-Weekday-03,18,Dixie,2,Courtneypark Dr e/of Dixie Rd,69,80,18_2,South,dixie,473,,,,,,,0,86,43.663557,-79.657966
23867704-240304-MULTI-Weekday-03,18,Dixie,2,Courtneypark Dr at 1750 Courtneypark Dr,71,80,18_2,South,dixie,473,,,,,,,0,88,43.667769,-79.653184
23867704-240304-MULTI-Weekday-03,18,Dixie,2,Courtneypark Dr w/of Netherhart Rd,73,80,18_2,South,dixie,473,,,,,,,0,90,43.671687,-79.648613
23867704-240304-MULTI-Weekday-03,18,Dixie,2,Netherhart Rd n/of Bonhill Rd,74,80,18_2,South,dixie,473,,,,,,,0,91,43.670504,-79.646871
23867704-240304-MULTI-Weekday-03,18,Dixie,2,Meyerside Dr at 1795 Meyerside Dr,76,80,18_2,South,dixie,473,,,,,,,0,93,43.666784,-79.646781
23867704-240304-MULTI-Weekday-03,18,Dixie,2,Meyerside Dr at 1715 Meyerside Dr,77,80,18_2,South,dixie,473,,,,,,,0,94,43.665361,-79.648289
